TitleForSorting,TitleClean,Status,Remarks,CarouselFlag,CarouselOrder,CarouselSnippet,ExampleFlag,ExampleSnippet,FilmReleased,Year,Released,Actors,Awards,WonAward,Country,Director,Genre,Plot,Poster,Rated,CurrentWar,Runtime,DatabaseTitle,ratingRT,ratingMetacritic,ratingImdb,imdbID,imdbVotes
ENEMY BELOW,ENEMY BELOW,APPROVED,FULL COOPERATION AT PEARL HARBOR FROM NAVY. PORTRAYS DUEL BETWEEN AN AMERICAN DESTROYER AND GERMAN SUBMARINE. GERMAN AND AMERICAN ARE BROTHERS IN ARMS WITH NO MENTION OF NATURE OF REGIME FOR WHICH THE GERMAN IS FIGHTING.,,,,,,TRUE,1957,1/17/1958,"Robert Mitchum, Curd JÃ¼rgens, David Hedison, Theodore Bikel",Won 1 Oscar. Another 2 wins & 3 nominations.,TRUE,USA,Dick Powell,"Action, Adventure, Drama, Thriller, War","During World War II, the USS Haynes, an American destroyer escort discovers a German U-boat in the South Atlantic. A deadly duel between the two ships ensues, and Captain Murrell must draw upon all his experience to defeat the equally experienced German commander.",https://m.media-amazon.com/images/M/MV5BNDNlNzBmZjgtNDBkMC00NjE0LTllY2UtODFiYTNiZmQ2NTE5XkEyXkFqcGdeQXVyNjQzNDI3NzY@._V1_SX300.jpg,Approved,Vietnam War,98,The Enemy Below,86%,,7.5,tt0050356,"9,665"
RUSSKIES,RUSSKIES,APPROVED,"PERMISSION FOR FLORIDA NATIONAL GUARD EQUIPMENT, INSTALLATION, AND PERSONNEL GRANTED. ALTHOUGH IT HAD NOTHING TO DO WITH THE GUARD, DOD FELT IT WOULD BE GOOD COMMUNITY RELATIONS FOR THE GUARD. NO RECORD OF FILM BEING MADE.",,,,,,TRUE,1987,11/6/1987,"Whip Hubley, Joaquin Phoenix, Peter Billingsley, Stefan DeSalle",,FALSE,USA,Rick Rosenthal,Drama,"It is during the Cold War and all Americans have a view of Russians as one thing: bad people. A group of American boys discovers a Russian sailor washed up on the coast of Florida and decide to befriend him, assuming that he is friendly and will bring them no danger and thus go against the ideas of their parents, as well as the government.",https://m.media-amazon.com/images/M/MV5BOTYwNDdhYTMtYjNhMi00NWM5LWJhODItOTQxNjIwMWJkMWZlXkEyXkFqcGdeQXVyMjY3MjUzNDk@._V1_SX300.jpg,PG,,99,Russkies,14%,43,5.6,tt0093898,"1,327"
RANDOM HEARTS,RANDOM HEARTS,APPROVED,"APPROVED USE OF NAVY SEARCH AND RESCUE PEOPLE AND EQUIPMENT TO ENACT FICTIONAL SAR EFFORTS AT CRASH SITE OF COMMERCIAL AIRCRAFT. MOVIE IS ESSENTIALLY A NON-MILITARY MELODRAMA / MYSTERY, BUT WITH 9-10 MINS OF NAVY COMMERCIAL.",,,,,,TRUE,1999,10/8/1999,"Harrison Ford, Kristin Scott Thomas, Charles S. Dutton, Bonnie Hunt",,FALSE,USA,Sydney Pollack,"Drama, Mystery, Romance",After the death of their loved ones in a tragic plane crash Harrison Ford and Kristin Scott Thomas find each others' keys in each others loved ones' possessions and realize that they were having an affair and must figure out all the details.,https://m.media-amazon.com/images/M/MV5BYWM1YmRkOWEtNDcyNS00ODE2LTkwNDAtOTA3OTA4ZTVlZTIwL2ltYWdlXkEyXkFqcGdeQXVyNTM3MDMyMDQ@._V1_SX300.jpg,R,,133,Random Hearts,15%,38,5.3,tt0156934,"19,758"
BATAAN,BATAAN,LIMITED,"CLASSIC ARMY STORY ABOUT FALL OF BATAAN. GROUP OF AMERICAN SOLDIERS FIGHT REAR GUARD ACTION, DYING ONE BY ONE STORY FILMED AT STUDIO AND OBTAINED LIMITED ASSISTANCE IN THE FORM OF INFORMATION. ARMY APPROVED COMPLETED PRODUCTION",,,,,,TRUE,1943,4/15/1944,"Robert Taylor, George Murphy, Thomas Mitchell, Lloyd Nolan",2 wins.,TRUE,USA,Tay Garnett,"Drama, War",Japan has just invaded the Phillipines and the US Army attempts a desperate defence. Thirteen men are chosen to blow up a bridge on the Bataan peninsula and keep the Japanese from rebuilding it.,https://m.media-amazon.com/images/M/MV5BNjNmMGZiZGQtNjJjMy00MzNlLWJiNjUtZTdmMmQ5YWQ0NzQ0XkEyXkFqcGdeQXVyNDYzNTI2ODc@._V1_SX300.jpg,Approved,World War II,114,Bataan,66%,,6.9,tt0035664,"2,206"
IN COUNTRY (1989),IN COUNTRY (1989),APPROVED,"AIR FORCE APPROVAL AFTER EARLIER DON BARUCH TURNDOWN, 19-JULY-1988 THE ARMY AND THE AIR FORCE CONCURRED ON PROVIDING ASSISTANCE FOR THE FILM, AFTER IT WAS UNDERSTOOD BY THE PRODUCTION THE RULES AND REGULATIONS OF THE DEPARTMENT",,,,,,TRUE,1989,9/29/1989,"Bruce Willis, Emily Lloyd, Joan Allen, Kevin Anderson",,FALSE,USA,Norman Jewison,"Drama, Romance, War","Samantha Hughes, a teenaged Kentucky girl, never knew her father, who died in Vietnam before her birth. Samantha lives with her uncle Emmett, who also served in Vietnam. Emmett hangs around with Tom, Earl, and Pete, three other Vietnam vets who, like Emmett, all have problems of one kind or another that relate to their war experiences. Sam, as Samantha is known, becomes obsessed with finding out about her father and his experiences, but Emmett and the other vets don't want to talk about the war. Sam pushes everyone to attend a dance honoring the town's veterans, but Pete and Earl get into a fight, Emmett disappears, and Tom takes Sam home for an unsuccessful tryst. When Sam reads her father's diary, she begins to understand what his life and death meant, and she and Emmett, with a trip to the Vietnam Veteran's Memorial, come at least temporarily to terms with the war in their lives.",https://m.media-amazon.com/images/M/MV5BYWNlNmEyY2MtYmVmZC00NzRhLTlkNjYtNmUwODdjNWM4NGNmXkEyXkFqcGdeQXVyNTAyODkwOQ@@._V1_SX300.jpg,R,,120,In Country,68%,,5.8,tt0097570,"2,692"
WHAT PRICE GLORY,WHAT PRICE GLORY,APPROVED,"CLASSIC MARINE STORY WHICH BECAME FILM AGAINST WHICH ALL OTHERS MEASURED. MARINES GAVE ASSISTANCE, ALTHOUGH COMBAT SEQUENCES ARE SPARSE. BASED ON ANTI-WAR PLAY, BUT END RESULT OF FILM IS TO SUGGEST WAR WAS A POSITIVE EXPERIENCE",,,,,,TRUE,1926,11/23/1926,"Edmund Lowe, Victor McLaglen, Dolores del Rio, William V. Mong",,FALSE,USA,Raoul Walsh,"Comedy, Drama, War","U.S. Marine sergeants Quirt and Flagg are inveterate romantic rivals on peacetime assignments in China and the Philippines. In 1917, W.W. I brings them to France, where Flagg, now a captain, takes up with flirtatious Charmaine, inn-keeper's daughter. Of course, Quirt has to arrive and spoil his fun. But the harsh realities of war and the threat of a shotgun marriage give the two men a common cause...",https://m.media-amazon.com/images/M/MV5BYWY2MTkwNzUtYjkwYy00YjA1LTgzOTItZmY1ZDMyMGE5ZTExXkEyXkFqcGdeQXVyMjUxODE0MDY@._V1_SX300.jpg,,,116,What Price Glory,100%,,7.2,tt0017540,308
GUARDING TESS,GUARDING TESS,APPROVED,COMPANY DID FILM ARRIVAL SCENE WITH AIR NATIONAL GUARD HANGARS AND AIRCRAFT IN BACKGROUND. ADVISED THAT THEY WERE GOING TO USE A NEWLY-RENTED CIVILIAN HELICOPTER ULTIMATELY USED NG HELICOPTER FOR NIGHT EVACUATION SCENE. PAID ALL EXPENSES,,,,,,TRUE,1994,3/11/1994,"Shirley MacLaine, Nicolas Cage, Austin Pendleton, Edward Albert",Nominated for 1 Golden Globe. Another 1 nomination.,TRUE,USA,Hugh Wilson,"Comedy, Drama","Doug is a Secret Service Agent who has just completed his stint in charge protecting Tess Carlisle, widow of a former U.S. President, and close personal friend of the President. He finds that she has requested that he not be rotated but instead return to be her permanent detail. Doug is crushed. He wants off her detail. She is very difficult to guard and makes her detail crazy with her whims and demands. Doug returns with no idea of how to continue dealing with her.",https://m.media-amazon.com/images/M/MV5BNzFkM2RiNWQtOWQxNy00ZWNmLWIyZTktNmJjZmY1ZTliZjU1XkEyXkFqcGdeQXVyNzc5MjA3OA@@._V1_SX300.jpg,PG-13,,96,Guarding Tess,57%,46,6.2,tt0109951,"15,252"
"CLIENT, THE",THE CLIENT,APPROVED,"COMPANY REQUESTED TO USE NATIONAL GUARD HANGAR AND EXTRAS TO ENACT SCENE IN WHICH ""THE CLIENT"" IS ACCEPTED INTO THE FEDERAL WITNESS PROTECTION PROGRAM UNDER HEAVY FBI/NATIONAL GUARD SECURITY. FBI SAID PORTRAYAL IS REALISTIC. APPROVED SUPPORT",,,,,,TRUE,1994,7/20/1994,"Susan Sarandon, Tommy Lee Jones, Mary-Louise Parker, Anthony LaPaglia",Nominated for 1 Oscar. Another 3 wins & 3 nominations.,TRUE,USA,Joel Schumacher,"Crime, Drama, Mystery, Thriller","Mark Sway is an 11 year old boy who lives with his mother and brother in a trailer. One day he and his brother are hanging out when a car pulls over beside them. The driver then sticks a hose in his exhaust and puts the other end into the car. Mark pulls it out. But the man sees him and grabs him and takes inside the car. The man talks to Mark then later shoots himself. The shock sends Mark's brother into a catatonic state. The police question him and slips out some stuff that makes them think he's saying more than he knows. Roy Foltrigg, a prosecutor with political ambitions tells Mark he wants to talk to him tomorrow. Mark feeling that he needs a lawyer, sees Reggie Love. Mark tells her about the man who killed himself. Reggie tells him he's a mob lawyer. And one of his clients is a member of a mob family who is suspected of killing a Senator who was trying to take down his family. But because the Senator's body is missing, they can't prosecute him. Reggie thinks Foltrigg thinks the lawyer told Mark where the body is which is why he wants to speak to him. Mark goes to meet Roy and when he threatens him, Mark steps out then Reggie comes in with a recording of his conversation with Mark telling him that made several violations. In the meantime, the mobster is told by the head of the family to take care of Mark. So he threatens Mark. Mark doesn't know what to do and learns that Reggie has some secrets of her own and is uncertain if he can trust her.",https://m.media-amazon.com/images/M/MV5BNGNjZWYwZGYtZWIxZC00OTYyLTllYTMtZWNiNmQ0YWUzMjkxXkEyXkFqcGdeQXVyMTQxNzMzNDI@._V1_SX300.jpg,PG-13,,119,The Client,78%,65,6.8,tt0109446,"59,303"
TROJAN HORSE,TROJAN HORSE,DENIED,THE FILM WAS DENIED BECAUSE IT DEPICTED THE PEACETIME ACTS OF WAR. IT ALSO PORTRAYED THE MURDER BY US MILITARY PERSONNEL OF A SIZEABLE NUMBER OF CZECH OFFICIALS AND MILITARY PERSONNEL. NO RECORD OF FILM BEING MADE,,,,,,FALSE,,,,,,,,,,,,,,,,,,,
ATTACK,ATTACK,DENIED,ATTACK WAS THE FIRST MAJOR MILITARY MOVIE IN THE POST-WORLD WAR II PERIOD WHICH DID NOT RECEIVE ARMY COOPERATION BECAUSE OF THE STORY LINE IN WHICH AN ENLISTED MAN KILLED HIS COMMANDER DUE TO THE OFFICER'S INCOMPETENCE.,,,,,,TRUE,1956,10/17/1956,"Jack Palance, Eddie Albert, Lee Marvin, Robert Strauss",1 win & 1 nomination.,TRUE,USA,Robert Aldrich,"Action, Drama, War","During the closing days of WWII, a National Guard Infantry Company is assigned the task of setting up artillery observation posts in a strategic area. Lieutenant Costa knows that Cooney is in command only because of 'connections' he had made state-side. Costa has serious doubts concerning Cooneys' ability to lead the group. When Cooney sends Costa and his men out, and refuses to re-enforce them, Costa swears revenge.",https://m.media-amazon.com/images/M/MV5BZjRlMzhkODktMmJiYS00NjUyLWExNzgtMzY5ZGUxMTNjYjRlXkEyXkFqcGdeQXVyNjQzNDI3NzY@._V1_SX300.jpg,Approved,Vietnam War,107,Attack,100%,,7.4,tt0048966,"4,603"
FAT MAN AND LITTLE BOY,FAT MAN AND LITTLE BOY,DENIED,"THE FILM WAS DENIED FOR APPROVAL BECAUSE IT PROVIDED AN INACCURATE PORTRAYAL OF THE ARMY. THIS WAS A ""MESSAGE"" FILM AGAINST THE ATOMIC BOMB. COMPLETE FICTION. IT BENEFITED THE ARMY AND THE DEPARTMENT IN NO WAY WHATSOEVER",,,,,,TRUE,1989,10/20/1989,"Paul Newman, Dwight Schultz, Bonnie Bedelia, John Cusack",2 nominations.,TRUE,"USA, Mexico",Roland JoffÃ©,"Biography, Drama, History, War","In real life, Robert Oppenheimer was the scientific head of the Manhattan Project, the secret wartime project in New Mexico where the first atomic bombs were designed and built. General Leslie Groves was in overall command of it. This film reenacts the project with an emphasis on their relationship.",https://m.media-amazon.com/images/M/MV5BMmUzNjY5NTAtODExZi00MDM5LWE0OGQtOWI0NGI3OTYzNmI3XkEyXkFqcGdeQXVyNjQzNDI3NzY@._V1_SX300.jpg,PG-13,,127,Fat Man and Little Boy,47%,,6.5,tt0097336,"6,827"
TARGET UNKNOWN,TARGET UNKNOWN,APPROVED,"STORY OF AMERICAN FLIERS SHOT DOWN OVER OCCUPIED FRANCE, CAPTURED, INTERROGATED, AND ESCAPE TO SEND MESSAGE OF WHERE TO BOMB TO HIT GASOLINE TANKS BEFORE INVASION. ONLY FILM TO FEATURE B-26 BOMBERS IN WORLD WAR II ACTION",,,,,,TRUE,1951,5/11/1951,"Mark Stevens, Alex Nicol, Robert Douglas, Don Taylor",,FALSE,USA,George Sherman,"Drama, War","In 1944, an American bomber squadron is tense and discontented from too many missions over France. Luck runs out for Capt. Stevens and his crew; they must bail out and are promptly taken prisoner. Their wily German captors, sensing that they have valuable information unknown even to themselves, use every form of velvet-glove trickery to worm it out of them. Will Stevens discover the danger? If so, what can he do about it? The fate of 100 planes depends on the answer...",https://m.media-amazon.com/images/M/MV5BNWU0MGEwYzItYTk1OC00ZGNjLThlODAtOWQwYTliZWZhMWZmXkEyXkFqcGdeQXVyMzk3NTUwOQ@@._V1_SX300.jpg,APPROVED,Korean War,90,Target Unknown,,,5.7,tt0044108,43
FIGHTER SQUADRON,FIGHTER SQUADRON,APPROVED,FIRST POST-WAR COMBAT FILM. PORTRAYED P-51 FIGHTERS IN SUMMER OF 1944. FIRST MOVIE TO USE COLORED COMBAT FOOTAGE. FIRST FILM OF ROCK HUDSON. SHOT WITH HELP OF WISCONSIN AIR NATIONAL GUARD . STILL CONSIDERED AN EXCITING FILM.,,,,,,TRUE,1948,11/27/1948,"Edmond O'Brien, Robert Stack, John Rodney, Tom D'Andrea",,FALSE,USA,Raoul Walsh,"Action, War","At an American air base in England, 1943, is conniving Sergeant Dolan, who manipulates everyone, and insubordinate ace fighter pilot Major Ed Hardin. When Ed is promoted to commander of his group, he must fight his former anti-authority stance as well as the enemy; tension grows as D-Day approaches. Generally lighthearted between moments of technicolor gore; lots of air combat footage, much of it genuine.",https://m.media-amazon.com/images/M/MV5BYTNjYmM4NmEtYmY1NS00MzZmLWFkZmYtOGQyODUyMmRhMWMwXkEyXkFqcGdeQXVyMTk2MzI2Ng@@._V1_SX300.jpg,Approved,,96,Fighter Squadron,50%,,6.2,tt0040353,630
IN THE LINE OF DUTY: SIEGE AT MARION,IN THE LINE OF DUTY: SIEGE AT MARION,DENIED,"AFTER THE UTAH STATE FILM COMMISSION FORWARDED THE SCRIPT, DOD DETERMINED THAT THE REQUEST FOR A UH-1H HELICOPTER WOULD BE DECLINED DUE TO AN INACCURATE SCENE AND THE POSSIBILITY OF COMPETITION BETWEEN DOD AND A PRIVATE INDUSTRY.",,,,,,TRUE,1992,2/10/1992,"Ed Begley Jr., Dennis Franz, Tess Harper, Paul Le Mat",,FALSE,USA,Charles Haid,"Action, Drama","Bob Bryant, F.B.I. agent in charge of an operation to arrest Adam Swapp and his brother Jonathan are suspects in the bombing of Mormon Center in Utah. The brothers and their families hold-up on their farm with provisions and enough ammunition to withstand the governments siege. They are devout in their beliefs and purposes and are determined to stand up for their rights.",https://m.media-amazon.com/images/M/MV5BODFkNTBmYmMtMjFjMi00MmJlLTg1YTctMTIxMzhjNGY0MzE1XkEyXkFqcGdeQXVyMjcyMDU4NA@@._V1_SX300.jpg,PG-13,,96,In the Line of Duty: Siege at Marion,,,5.5,tt0104500,120
"PURPLE HEART, THE",THE PURPLE HEART,OTHER,THIRD IN TRILOGY ABOUT THE DOOLITTLE RAID. TOTALLY FICTIONAL ACCOUNT OF TRIAL OF EIGHT OF DOOLITTLE'S FLIERS AND THEIR EXECUTION (OFF SCREEN). HELPED WAR EFFORT BY SHOWING EVIL ENEMY. NO ASSISTANCE NEEDED SINCE SHOT ON SOUND STAGE.,,,,,,TRUE,1944,2/23/1944,"Dana Andrews, Richard Conte, Farley Granger, Kevin O'Shea",,FALSE,USA,Lewis Milestone,"Drama, History, War","This is the story of the crew of a downed bomber, captured after a run over Tokyo, early in the war. Relates the hardships the men endure while in captivity, and their final humiliation: being tried and convicted as war criminals.",https://m.media-amazon.com/images/M/MV5BNDk0MDc1Njc0MV5BMl5BanBnXkFtZTgwNTY5NTY3MzE@._V1_SX300.jpg,Approved,World War II,99,The Purple Heart,40%,,6.6,tt0037197,819
TRANSFER OF COURAGE,TRANSFER OF COURAGE,APPROVED,PROVIDED TENTAGE AND SANDBAGS THAT WERE NOT COMMERCIALLY AVAILABLE. FILM FOUND DOD AND MARINE CORPS AGREED TO USE OF WAKE ISLAND. WAS REASONABLY ACCURATE IN ITS PORTRAYAL OF EVENTS. DON'T KNOW IF FILM EVER PRODUCED (MONEY PROBLEMS).,,,,,,FALSE,,,,,,,,,,,,,,,,,,,
SUBMARINE D-1,SUBMARINE D-1,APPROVED,SUBMARINE DISASTER MOVIE WHICH SHOWED NAVY'S DEVELOPMENT OF MCCANN DIVING BELL TO RESCUE SAILORS FROM SUNKEN SUBMARINES. BECAME ALMOST PROPHETIC SINCE BELL WAS USED TO RESCUE MEN FROM THE SQUALUS. FILMING AT SUBMARINE BASE IN NEW LONDON.,,,,,,TRUE,1937,11/27/1937,"Pat O'Brien, George Brent, Wayne Morris, Frank McHugh",,FALSE,USA,Lloyd Bacon,"Action, Drama","Navy officers fall for Ann. She has her own plans. USS Pensacola is struck during a last dive drill, there is an attempt to rescue. The USS Dolphin (D-1) and her crew depart from ...",https://m.media-amazon.com/images/M/MV5BOTdkN2UzNjctZDJjZC00YTRlLThmYmItMTc3NjBiM2EwMWE3XkEyXkFqcGdeQXVyNjQzNDI3NzY@._V1_SX300.jpg,Passed,,100,Submarine D-1,,,6,tt0029617,164
"GREAT SANTINI, THE",THE GREAT SANTINI,OTHER,"APPROVED USE OF MARINE AIRCRAFT, PERSONNEL, AND INSTALLATIONS. NEGOTIATIONS EXTENDED OVER A LONG PERIOD DUE TO PROBLEMS WITH PORTRAYAL OF MARINE OFFICER AS WIFE AND CHILD ABUSER, A PATTON-TYPE WARRIOR, NEEDED IN WAR BUT LOST IN PEACETIME.",,,,,,TRUE,1979,10/26/1979,"Robert Duvall, Blythe Danner, Michael O'Keefe, Lisa Jane Persky",Nominated for 2 Oscars. Another 3 wins & 4 nominations.,TRUE,USA,Lewis John Carlino,Drama,"In 1962, the Marine Corps family, the Meechums - parents Lieutenant Colonel Wilbur ""Bull"" Meechum and Lillian Meechum, and their four children Ben Meechum, Mary Anne Meechum, Karen Meechum and Matthew Meechum - are moving like they do most years, this time to Beaufort, South Carolina. Bull - nicknamed ""the Great Santini"" - is known as a great pilot, but has gotten into much trouble in the past for his sophomoric behavior. He runs his family much as a military commander, where they are all to obey his orders without question. Everything he does within the family context he reasons is to build character, but in reality everything ends up being about him. The oldest Ben, approaching manhood, is the one of his offspring who has the greatest issue with his father. Ben wants his respect, but isn't sure if he really loves him. As Ben goes through his senior year in high school, his attempts to play varsity basketball and an incident between black Toomer Smalls - his friend and their cook Arrabella Smalls' son - and racist Red Petus may forever change the dynamic between father and son.",https://m.media-amazon.com/images/M/MV5BMGQwZjA0ZTgtZTMzYy00Y2FiLWJhZGUtNGI0MzEzYmFhNmZjXkEyXkFqcGdeQXVyNTc1NTQxODI@._V1_SX300.jpg,PG,,115,The Great Santini,95%,,7.2,tt0079239,"5,365"
SAN FRANCISCO,SAN FRANCISCO,APPROVED,"INTERESTING STORY OF COOPERATION. DIRECTOR W.S VAN DYKE WAS A MARINE RESERVE OFFICER. NEEDED EXTRAS WHO COULD OBEY SPLIT SECOND ORDERS DURING CLIMATIC EARTHQUAKE AND OBTAINED PERMISSION TO USE ACTIVE DUTY MARINES IN SCENES OF DESTRUCTION, ETC",,,,,,TRUE,1936,6/26/1936,"Clark Gable, Jeanette MacDonald, Spencer Tracy, Jack Holt",Won 1 Oscar. Another 2 wins & 6 nominations.,TRUE,USA,W.S. Van Dyke,"Drama, Musical, Romance","Mary Blake arrives at Blackie Norton's Paradise gambling hall and beer garden looking for work as a singer. Blackie embarrasses her by asking to see her legs, but does hire her. She faints from hunger. Nob Hill Socialite Jack Burley and Maestro Baldini of the Tivoli Opera House see her singing and offer her a chance to do opera, but Blackie has her under a two-year contract which she sorrowfully stands by. Later, when he makes up posters featuring Mary in tights, she does leave for the Tivoli. Blackie gets an injunction against Burley, but knocks out the process server when he hears Mary's performance as Marguerite in ""Faust"". She asks her to marry him and she agrees to go back to the Paradise as his kind of singer, but Blackie's childhood chum Father Tim intervenes. After Blackie slugs the priest, Mary leaves. She is soon the star of the Tivoli and Blackie's place is closed down. She sings a rousing ""San Francisco"" on behalf of the Paradise at the annual ""Chicken Ball"" and wins the $10,000 prize which Blackie throws to the floor. As she storms out of the hall a terrible rumble betokens the famous San Francisco earthquake. Buildings collapse, streets split wide open, the city burns, the army dynamites whole sections of town. After staggering around in a stupor Blackie finds Father Tim and the two of them find Mary at a Salvation Army camp. Backed by hundreds of others, they look out over the ruins which are gradually replaced by the shining new city with a reprise of the title song.",https://m.media-amazon.com/images/M/MV5BMjM4MjA5MDU0Nl5BMl5BanBnXkFtZTgwOTIyNTczMjE@._V1_SX300.jpg,Passed,,115,San Francisco,100%,,7.2,tt0028216,"4,802"
"PEREZ FAMILY, THE",THE PEREZ FAMILY,APPROVED,"LARGELY BACKGROUND BUT IMPORTANT TO STORY. POSITIVE, ACCURATE DEPICTION. NO FILE. REQUESTED USE OF FLORIDA NATIONAL GUARDSMEN TO REENACT THE HUMANITARIAN AID THEY PROVIDED (WITH TENTS, TRUCKS) TO CUBAN REFUGEES DURING THE MARIEL EXODUS. 12 SHOOTING DAYS.",,,,,,TRUE,1995,5/12/1995,"Marisa Tomei, Alfred Molina, Anjelica Huston, Chazz Palminteri",,FALSE,USA,Mira Nair,"Comedy, Romance, Drama","In an attempt to secure a sponsor, an unlikely group of Cuban refugees become a ""family"" as the U.S. Immigration and Naturalization Service gives families priority over others. In the process, a political prisoner who hasn't seen his wife for twenty years and a disaffected sugarcane cutter fall in love. An excitable brother and a lovestruck cop contribute to the general confusion. The inevitable humorous romantic entaglements ensue as a final confrontation is set up.",https://m.media-amazon.com/images/M/MV5BMTk1MTI2Nzg0NF5BMl5BanBnXkFtZTcwOTcwOTc2NA@@._V1_SX300.jpg,R,,113,The Perez Family,65%,,6,tt0114113,"2,086"
EAGLE IN THE SKY,EAGLE IN THE SKY,DENIED,"THE FILM WAS DENIED BY THE US NAVY AND DOD, AS COMPLETELY UNREALISTIC -- REQUESTOR HAD WANTED USE OF AIRCRAFT FOR FILM IT DEPICTED OF THE NAVY. THE DEPARTMENT DECLINED TO ASSIST. NO RECORD OF FILM BEING MADE",,,,,,FALSE,,,,,,,,,,,,,,,,,,,
CRASH DIVE (1996),CRASH DIVE (1996),OTHER,"DID NOT REQUEST ASSISTANCE, DATE APPROXIMATE, NO FILE STORY OF US NAVAL OFFICER DETAILED TO A RUSSIAN SUBMARINE IN POST-COLD WAR ERA. FINDS TERRORISTS IN CONTROL OF SUB WHO WANT TO FIRE MISSILES. US OFFICER SAVES THE DAY.",,,,,,TRUE,1996,3/28/1997,"Michael Dudikoff, Frederic Forrest, Reiner SchÃ¶ne, Jay Acovone",,FALSE,USA,Andrew Stevens,"Action, Drama, Thriller","The crew of the nuclear submarine USS Ulysses rescues supposed victims of a boat disaster, but the victims turn out to be terrorists intent on capturing nuclear weapons aboard the sub. Only a former SEAL, now a submarine consultant, can save the crew by sliding aboard while the sub is underwater. The term ""crash dive"" refers to the sudden dropping of a sub to escape detection, an act that a nuclear sub is never supposed to make. Of course, it comes into play in this film.",,R,,90,Crash Dive,19%,,4.3,tt0115965,763
"Q STREET, THE",THE Q STREET,DENIED,"DOD AND NAVY ASSISTANCE WAS DENIED BECAUSE THE FILM FEATURES A GOV. ORDERED & SANCTIONED ASSASSINATION OF A VERY IMPORTANT US CITIZEN, WHILE HELD FORCIBLY AT THE BETHESDA NAVAL HOSPITAL. NO FILE. NO RECORD OF FILM BEING MADE",,,,,,FALSE,,,,,,,,,,,,,,,,,,,
LARGER THAN LIFE,LARGER THAN LIFE,APPROVED,APPROVED USE OF C-5 AIRCRAFT (NON-FLYING) ON THE GROUND AT SO CAL AIRPORT FOR SCENE IN WHICH THE USAF IS HELPING RELOCATE ELEPHANTS TO SRI LANKA FOR AN ANIMAL CONSERVATION PROJECT. REASONABLY ACCURATE & VERY POSITIVE. NO FILE.,,,,,,TRUE,1996,11/1/1996,"Jerry Adler, Bill Murray, Richard Alan Baker, Richie Allan",,FALSE,USA,Howard Franklin,"Comedy, Family","Motovational Speaker Jack Corcoran is determined to get his career off the ground, but the biggest gigs he can get are the ones nobody wants. Then one day, he receives a telegram that his circus clown father has passed away, and has left a ""huge"" inheritance. When he gets there, he finds that his inheritance has come in the form of a elephant that was his father's pride and joy in circus acts. His main intention is to sell the pacaderm off. Jack must choose between loud and rude zookeeper Mo or attractive animal show owner Terry. As the two trek through the country Jack and the elephant develop a bond, and it changes his approach on life for the better.",https://m.media-amazon.com/images/M/MV5BNDg3NTYyYjktZWZjOC00ZTIwLTgwMzQtMDdjYjY1NmQxN2RlXkEyXkFqcGdeQXVyNTM5NzI0NDY@._V1_SX300.jpg,PG,,93,Larger Than Life,11%,43,5.7,tt0116823,"6,710"
"THIN RED LINE, THE (1998)",THE THIN RED LINE (1998),DENIED,"EARLY ON, PRODUCER MISUNDERSTOOD ARMY'S COMMENTS AND THOUGHT HE HAD RECEIVED APPROVAL. DESPITE MANY ""POLITICAL"" CONTACTS, ARMY REFUSED TO ASSIST DUE TO LACK OF ANY KIND OF BALANCE IN THE SCRIPT. NO EQUIPMENT TO PROVIDE IN ANY CASE",,,,,,TRUE,1998,1/15/1999,"Kirk Acevedo, Penelope Allen, Benjamin Green, Simon Billig",Nominated for 7 Oscars. Another 21 wins & 40 nominations.,TRUE,"USA, Australia",Terrence Malick,"Drama, War","U.S. Army Private Witt (AWOL) is found and imprisoned on a troop carrier by his company First Sergeant, Welsh.The men of C Company,1st Battalion,27th Infantry Regiment,25th Infantry Division have been brought to Guadalcanal as reinforcements in the campaign to secure Henderson Field and seize the island from the Japanese. They arrive near Hill 210, a key Japanese position. Their task is to capture the hill at all cost. What happens next is a story developing about redemption and the meaningless of war. Regardless the outcome.",https://m.media-amazon.com/images/M/MV5BYjEzMTM2NjAtNWFmZC00MTVlLTgyMmQtMGQyNTFjZDk5N2NmXkEyXkFqcGdeQXVyNzQ1ODk3MTQ@._V1_SX300.jpg,R,,170,The Thin Red Line,80%,78,7.6,tt0120863,"169,961"
