TitleForSorting,TitleClean,Status,Remarks,CarouselFlag,CarouselOrder,CarouselSnippet,ExampleFlag,ExampleSnippet,FilmReleased,Year,Released,Actors,Awards,WonAward,Country,Director,Genre,Plot,Poster,Rated,CurrentWar,Runtime,DatabaseTitle,ratingRT,ratingMetacritic,ratingImdb,imdbID,imdbVotes
BACK TO BATAAN,BACK TO BATAAN,APPROVED,"AS TITLE SUGGESTS, A STORY ABOUT THE ARMY'S RETURN TO THE PHILIPPINES. JOHN WAYNE ACTION MOVIE. USE OF MEN AND EQUIPMENT FOR COMBAT SEQUENCES",,,,,,TRUE,1945,5/31/1945,"John Wayne, Anthony Quinn, Beulah Bondi, Fely Franquelli",,FALSE,USA,Edward Dmytryk,"Drama, War","The US Army's defense of its Philippines colony and the allied Malay countries/colonies behind it counted on its island fortress of Corregidor on Luzon -and a few others- but loses it in the 6 May 1942 Japanese combined forces attack. Colonel Joseph Madden is among the escaping survivors who are ordered by general Douglas McArthur to organize a guerrilla. As he finds many native Filipinos inclined to resist the occupier's vision of returning to the South Asian fold under a paternalistic empire which doesn't hesitate to 'spank the unruly', but is mainly civilian, unprepared, inept in military matters, Madden appeals to the legendary anti-US freedom fighter Andres BonifÃ¡cio's homonymous grandson Captain AndrÃ©s BonifÃ¡cio, who is luckily rescued from a POW dead march, to inspire the resistance -once his own fighting spirit is rekindled- with him in a still very unsure war, retaliated by bloody, ten to one repression. When the Japanese realize the people side against them, they stage fake independence under imperial prince Ito, but are betrayed. While the tide of war turns against Japan all around the Pacific, the bitter fight intensifies further...",https://m.media-amazon.com/images/M/MV5BYzMzNDc5MGItOTMzZi00MzcxLTljYjAtMDJjYjcxZmJiN2Y5XkEyXkFqcGdeQXVyMTIzMzQ1ODg4._V1_SX300.jpg,Approved,World War II,95,Back to Bataan,63%,,6.7,tt0037522,"3,580"
ANGEL'S FLIGHT,ANGEL'S FLIGHT,APPROVED,"APPROVED BY THE DEPARTMENT AFTER BEING REVIEWED. THE DEPARTMENT FELT IT WOULD BE BENEFICIAL TO THE NAVY. NO FILE, NO RECORD FILM EVER PRODUCED.",,,,,,FALSE,,,,,,,,,,,,,,,,,,,
FLYING TIGERS,FLYING TIGERS,APPROVED,ARMY AIR CORPS PROVIDED FIGHTER PLANES FOR FICTIONAL STORY OF THE AMERICAN VOLUNTEER FLIERS IN CHINA IN THE MONTHS BEFORE AND AFTER PEARL HARBOR,,,,,,TRUE,1942,10/8/1942,"John Wayne, John Carroll, Anna Lee, Paul Kelly",,FALSE,USA,David Miller,"Action, Drama, Romance, War","Jim Gordon commands a unit of the famed Flying Tigers, the American Volunteer Group which fought the Japanese in China before America's entry into World War II. Gordon must send his outnumbered band of fighter pilots out against overwhelming odds while juggling the disparate personalities and problems of his fellow flyers. In particular, he must handle the difficulties created by a reckless hot-shot pilot named Woody Jason, who not only wants to fight a one-man war but to waltz off with Gordon's girlfriend.",https://m.media-amazon.com/images/M/MV5BZDEzOWM3YjctMDRjNy00OWYwLWI2OTYtZGE5ZmExNDg2MDI4XkEyXkFqcGdeQXVyNjQzNDI3NzY@._V1_SX300.jpg,Approved,World War II,102,Flying Tigers,67%,,6.8,tt0034742,"3,422"
MEGAFORCE,MEGAFORCE,OTHER,"DONALD BARUCH APPROVAL. THE USE OF AIR FORCE'S C-130 AIRCRAFT ALONG WITH PERSONNEL WAS APPROVED, SINCE THE FILM POSED NO THREAT TO THE DEPARTMENT.",,,,,,TRUE,1982,6/25/1982,"Barry Bostwick, Michael Beck, Persis Khambatta, Edward Mulhare",3 nominations.,TRUE,"Hong Kong, USA",Hal Needham,"Action, Sci-Fi","Ace Hunter is the leader of Megaforce, an elite group of American soldiers who travel the world to fight Evil. In this case, Evil is represented by a third rate dictator who they must blow to bits.",https://m.media-amazon.com/images/M/MV5BM2JkYzU2NzEtZTEwZS00ZWIwLThjNzItYjgwNzk2YzYwMGQyXkEyXkFqcGdeQXVyNzc5MjA3OA@@._V1_SX300.jpg,PG,,99,Megaforce,0%,,3.8,tt0084316,"3,282"
AMAZING GRACE AND CHUCK,AMAZING GRACE AND CHUCK,DENIED,"STORY DOES NOT ACCURATELY PORTRAY US EFFORTS TO MAINTAIN NUCLEAR DETERRENCE, TO SEEK ARMS REDUCTIONS, AND TO KEEP THE PEACE. ASSISTANCE DENIED. NO FILE",,,,,,TRUE,1987,10/24/1987,"Dean Alexander, Jamie Lee Curtis, Jim Allen, Gregory Peck",3 nominations.,TRUE,USA,Mike Newell,"Drama, Sport","Chuck Murdock is an all American kid living in a sleepy town in Montana. He is the top pitcher of the little league team as well. After taking a tour of a nuclear silo, Chuck decides to quit playing little league until nuclear weapons are disarmed. Boston Celtic Amazing Grace Smith hears about Chuck's exploits, and decides to do the same thing. Amazing then moves to the young boy's town to live. More athletes follow suit as well. The town begins to hate Chuck and his family, and this makes Chuck's father angry. But can one kid's message make the world listen?",https://m.media-amazon.com/images/M/MV5BOTkxN2I2MWYtNTlmYy00Y2YyLWFkYzgtM2NiNTExNWI4ZWIxXkEyXkFqcGdeQXVyNzc5MjA3OA@@._V1_SX300.jpg,PG,,114,Amazing Grace and Chuck,38%,,6,tt0092545,"1,241"
SAYONARA,SAYONARA,APPROVED,"AIR FORCE INITIALLY RELUCTANT TO PROVIDE ASSISTANCE BECAUSE OF INTERRACIAL DATING AND SUICIDE OF ONE OF ITS ENLISTED MEN. ULTIMATELY, PROVIDED PLANES AND EQUIPMENT",,,,,,TRUE,1957,12/20/1957,"Marlon Brando, Patricia Owens, James Garner, Martha Scott",Won 4 Oscars. Another 4 wins & 18 nominations.,TRUE,USA,Joshua Logan,"Drama, Romance","Major Lloyd Gruver, a Korean War flying ace reassigned to Japan, staunchly supports the military's opposition to marriages between American troops and Japanese women. But that's before Gruver experiences a love that challenges his own deeply set prejudices... and plunges him into conflict with the U.S. Air Force and Japan's own cultural taboos.",https://m.media-amazon.com/images/M/MV5BYjY5OTRhYTAtZmM5Ni00NjU5LWI3OWEtYzBlMWJkOTMyNTFiXkEyXkFqcGdeQXVyMDI2NDg0NQ@@._V1_SX300.jpg,Not Rated,Vietnam War,147,Sayonara,93%,,7.1,tt0050933,"5,909"
"MORAL ISSUE, A",A MORAL ISSUE,OTHER,"THERE ARE NO RECORDS OF DOD EVER APPROVING THE FILM. THE FILM WAS NEVER PRODUCED, SO EVIDENTLY IF ANY RESPONSE WAS GIVEN, IT WAS NO",,,,,,FALSE,,,,,,,,,,,,,,,,,,,
FIXED BAYONETS,FIXED BAYONETS,LIMITED,KOREAN WAR STORY THAT COULD HAVE AS EASILY BEEN SET IN WORLD WAR II. ARMY PROVIDED LIMITED ASSISTANCE FOR STORY FILMED MOSTLY IN THE STUDIO,,,,,,TRUE,1951,12/6/1951,"Richard Basehart, Gene Evans, Michael O'Shea, Richard Hylton",,FALSE,USA,Samuel Fuller,"Action, Drama, War",The story of a platoon during the Korean War. One by one Corporal Denno's superiors are killed until it comes to the point where he must try to take command responsibility.,https://m.media-amazon.com/images/M/MV5BY2NiYmI0YjYtMGJhMy00ZTQ2LTg4ODMtOWE0NTUxZTUyNWJlL2ltYWdlL2ltYWdlXkEyXkFqcGdeQXVyNjc1NTYyMjg@._V1_SX300.jpg,Not Rated,Korean War,92,Fixed Bayonets!,100%,,6.9,tt0043540,"1,687"
RETREADS,RETREADS,DENIED,DISAPPROVED BY BOTH THE AIR FORCE AND THE DEPARTMENT OF DEFENSE. THE REQUEST FOR VEHICLES WAS OF COURSE DENIED. NO RECORD OF FILM BEING MADE,,,,,,TRUE,1988,1/1/1988,"Mike Bacarella, Laura Banks, Jerry Brent, Joe Estevez",,FALSE,USA,James Connell,Adventure,,,,,104,Retreads,,,2,tt0283856,6
BROKEN ARROW,BROKEN ARROW,DENIED,RENEGADE AIR FORCE PILOT STEALS TWO NUCLEAR WEAPONS TO SELL TO HIGHEST BIDDER. OBVIOUSLY NO WAY THE AIR FORCE WOULD HELP ON SUCH A PORTRAYAL.,,,,,,TRUE,1996,2/9/1996,"John Travolta, Christian Slater, Samantha Mathis, Delroy Lindo",1 win & 3 nominations.,TRUE,USA,John Woo,"Action, Adventure, Thriller","Broken Arrow is the term used to describe a nuclear device that has been lost. In this movie, two nuclear missiles are stolen by rogue US pilot Deakins, but hot on his trail is his co-pilot Hale and a Park Ranger, Terry. The action takes place in Utah's canyon country; a high stakes game of cat and mouse.",https://m.media-amazon.com/images/M/MV5BYzU2NDg3ZTItNzRmNy00NTQzLTljMDUtNjczOTMwZjEzNWVkXkEyXkFqcGdeQXVyMTQxNzMzNDI@._V1_SX300.jpg,R,,108,Broken Arrow,52%,61,6.1,tt0115759,"89,823"
KINGS GO FORTH,KINGS GO FORTH,APPROVED,ROMANCE SET IN FRANCE DURING WORLD WAR II. TWO FRIENDS FALL FOR SAME FRENCH GIRL NOT KNOWING SHE IS HALF-BLACK. ARMY PROVIDED MEN AND EQUIPMENT,,,,,,TRUE,1958,6/28/1958,"Frank Sinatra, Tony Curtis, Natalie Wood, Leora Dana",,FALSE,USA,Delmer Daves,"Action, Drama, Romance, War","Race, love, and war. The Allies have landed in France, set up in a coastal town, where Lt. Sam Loggins, a serious guy from Manhattan's west side, falls hard for Monique Blair, an American raised in France. Loggins' sergeant, Britt Harris, a playboy from Jersey, also finds Monique attractive. She chooses one to love and the other to befriend after disclosing her parents' history and why she lives in France. The men say it makes no difference, a wedding is announced, and the soldiers face a dangerous mission behind enemy lines. But is everyone being truthful?",https://m.media-amazon.com/images/M/MV5BMTUzNTQ1NzEwM15BMl5BanBnXkFtZTcwMDYzNzA2NA@@._V1_SX300.jpg,Approved,Vietnam War,109,Kings Go Forth,63%,,6.5,tt0051819,"1,364"
50/50,50/50,OTHER,NEVER WAS OFFICIALLY SUBMITTED TO DOD. IT WAS STOPPED BEFORE IT GOT TO THE DEPARTMENT NO REASON FOR SUPPORT WAS EVER FORTHCOMING. NO FILE EXISTS,,,,,,TRUE,2011,9/30/2011,"Joseph Gordon-Levitt, Seth Rogen, Anna Kendrick, Bryce Dallas Howard",Nominated for 2 Golden Globes. Another 12 wins & 26 nominations.,TRUE,USA,Jonathan Levine,"Comedy, Drama, Romance","Adam is a 27 year old writer of radio programs and is diagnosed with a rare form of spinal cancer. With the help of his best friend, his mother, and a young therapist at the cancer center, Adam learns what and who the most important things in his life are.",https://m.media-amazon.com/images/M/MV5BNjg3ODQyNTIyN15BMl5BanBnXkFtZTcwMjUzNzM5NQ@@._V1_SX300.jpg,R,Iraq War,100,50/50,93%,72,7.6,tt1306980,"312,763"
BIG JIM MCLAIN,BIG JIM MCLAIN,LIMITED,COLD WAR ESPIONAGE MOVIE WITH JOHN WAYNE AS HERO. NAVY PROVIDED LOCATIONS IN PEARL HARBOR FOR BACKGROUND SHOTS OF SHIPS AND WAYNE ABOARD A SHIP.,,,,,,TRUE,1952,8/30/1952,"John Wayne, Nancy Olson, James Arness, Alan Napier",,FALSE,USA,Edward Ludwig,"Crime, Drama, History, Romance, Thriller","U.S. House Un-American Activities Committee investigators Jim McLain and Mal Baxter attempt to break up a ring of Communist Party troublemakers in Hawaii (ignoring somewhat, as do their superiors in the Congress, that membership in the Communist Party was, at the time, legal in the U.S.)",https://m.media-amazon.com/images/M/MV5BZmRmZGYyZmItYjFlYS00NzQyLWE1NjktMzJiYTM4ZjI0M2U0XkEyXkFqcGdeQXVyMDI2NDg0NQ@@._V1_SX300.jpg,Approved,Korean War,90,Big Jim McLain,40%,,5.4,tt0044418,"1,768"
CRY FOR HAPPY,CRY FOR HAPPY,LIMITED,PEACETIME MOVIE SET IN OCCUPIED JAPAN WITH NAVY PHOTO TEAM SETTING UP HOUSEKEEPING IN A GEISHA HOUSE. LIMITED USE OF MEN AND SHIPS AS BACKGROUND,,,,,,TRUE,1961,1/1/1961,"Glenn Ford, Donald O'Connor, Miiko Taka, James Shigeta",,FALSE,USA,George Marshall,"Comedy, Romance",U.S. Navy photographic team uses Tokyo geisha house as its home.,https://m.media-amazon.com/images/M/MV5BNGRiMDMzMzItNmZlZi00YmM3LTk2MWQtODM0NjJiZjdiZTNkXkEyXkFqcGdeQXVyNzc5MjA3OA@@._V1_SX300.jpg,,Vietnam War,110,Cry for Happy,,,6.2,tt0054772,192
DARBY'S RANGERS,DARBY'S RANGERS,APPROVED,ARMY PROVIDED FULL COOPERATION ON STORY BASED ON FACT OF RANGERS IN NORTH AFRICA AND ITALY DURING WORLD WAR II. SERVICE PROVIDED MEN AND EQUIPMENT.,,,,,,TRUE,1958,4/8/1958,"James Garner, Etchika Choureau, Jack Warden, Edd Byrnes",,FALSE,USA,William A. Wellman,"Action, Drama, War","Highly fictionalized account of the formation of the US Army's First Ranger Battalion in World War II and their first commanding officer Major (later, Lieutenant-Colonel) Orlando Darby. The idea was to create a US unit along the lines of the British commandos. In this account, which focuses on several fictional characters, the story is initially on their training in Scotland and the lives and loves their encounter while there. Their first combat mission was in the invasion of North Africa in 1942, followed by the invasion of Sicily and then Italy itself, including the amphibious landing at Anzio.",https://m.media-amazon.com/images/M/MV5BZGQ2MzZkZDgtM2JmNC00YTU0LTlmZGYtMWYxODNlNTc2YTM0XkEyXkFqcGdeQXVyMTMxMTY0OTQ@._V1_SX300.jpg,Approved,Vietnam War,121,Darby's Rangers,44%,,6.4,tt0051519,"1,147"
FRANCIS IN THE NAVY,FRANCIS IN THE NAVY,APPROVED,"ANOTHER IN THE SERIES OF FRANCIS THE TALKING MULE COMEDIES. THE NAVY PROVIDED SHIPS, MEN, AND LOCALES AS BACKGROUND TO THE COMEDY. TYPICAL SERVICE FARCE.",,,,,,TRUE,1955,8/24/1955,"Donald O'Connor, Martha Hyer, Richard Erdman, Jim Backus",,FALSE,USA,Arthur Lubin,"Comedy, Fantasy",A story following Lieutenant Peter Stirling (Donald O'Connor) and his dream of being in the Navy.,https://m.media-amazon.com/images/M/MV5BNjYwMzcyMzU4NV5BMl5BanBnXkFtZTcwMDA0MTAyMQ@@._V1_SX300.jpg,Approved,,80,Francis in the Navy,57%,,5.9,tt0048092,557
BOMBERS B-52,BOMBERS B-52,APPROVED,PRO-SAC FILM MADE WITH FULL COOPERATION OF CURTIS LEMAY AND THE AIR FORCE. PORTRAYED THE TRANSITION FROM 0475 TO B-SZS. BLATANT PROPAGANDA FOR SAC MISSION,,,,,,TRUE,1957,12/26/1957,"Natalie Wood, Karl Malden, Marsha Hunt, Efrem Zimbalist Jr.",,FALSE,USA,Gordon Douglas,"Drama, Romance, War","U.S Air Force Sgt. Chuck Brennan always disliked playboy and hotshot, Col. Jim Herlihy. He first met him in Korea, where his emergency arrival for repairs while enroute for what Chuck thought was the colonels ""hot date"" in Tokyo, caused the death of several of his crewmen. Now several years later when Chuck, while still in the Air Force, is now weighing continued enlistment or retirement, the base's new C.O. is none other than Col. Herlihy. Compounding his dislike is a budding romance with Chuck's daughter, Lois.",https://m.media-amazon.com/images/M/MV5BYzQ1OTM2YTktODJjYi00Y2IwLTgzOGEtMDAxODM2YmQxM2ZmXkEyXkFqcGdeQXVyNjQzNDI3NzY@._V1_SX300.jpg,Not Rated,Vietnam War,106,Bombers B-52,32%,,5.9,tt0050204,681
DON'T GO NEAR THE WATER,DON'T GO NEAR THE WATER,APPROVED,NAVY COMEDY IN SOUTH SEAS WORLD WAR II SETTING. SAILORS BUILDING A RECREATION HALL ON ISLAND-NAVY PROVIDED FULL COOPERATION (MOSTLY SAILORS AND SHIPS IN BACKGROUND).,,,,,,TRUE,1957,12/1/1957,"Glenn Ford, Gia Scala, Earl Holliman, Anne Francis",Nominated for 2 Golden Globes. Another 1 win & 4 nominations.,TRUE,USA,Charles Walters,"Adventure, Comedy, Romance, War","On a small island in the South Pacific, the Navy's P.R. department is spending WWII without getting near a ship. Lt. Max Siegal is the Second in command to a clueless Commanding Officer who believes Sea Duty to be the worst punishment he can give one of his men. Siegal has to keep the foreign correspondents happy, keep his Commander out of trouble and figure out a way for one of the enlisted sailors to date the lady Lieutenant of his dreams - all while convincing a certain island schoolteacher that he's the man for her.",https://m.media-amazon.com/images/M/MV5BZGFlNDBlMWItMDRjMC00NzMyLWJhNDgtMGI2ZTYwN2ZmMWFiXkEyXkFqcGdeQXVyMTIxOTk5MzY@._V1_SX300.jpg,Approved,Vietnam War,107,Don't Go Near the Water,15%,,6.3,tt0050327,607
GATHERING OF EAGLES,GATHERING OF EAGLES,APPROVED,"POSITIVE PORTRAYAL OF SAC, COMPARED TO ""DR. STRANGELOVE"" AND ""FAIL SAFE,"" THEN IN PRODUCTION. FILM RECEIVED FULL COOPERATION FROM SAC AND SHOT ON MILITARY LOCATIONS.",,,,,,TRUE,1963,6/21/1963,"Rock Hudson, Rod Taylor, Mary Peach, Barry Sullivan",,FALSE,USA,Delbert Mann,"Drama, Romance, War","Rock Hudson plays an Air Force Colonel who has just been re-assigned as a cold war B-52 commander who must shape up his men to pass a grueling inspection that the previous commander had failed, and had been fired for. He is also recently married, and as a tough commanding officer doing whatever he has to do to shape his men up, his wife sees a side to him that she hadn't seen before.",https://m.media-amazon.com/images/M/MV5BYjdlYjE2YTItZmQwNS00OGQ5LThjMzYtNzQ3NDk2ZTYxY2QxXkEyXkFqcGdeQXVyNjQzNDI3NzY@._V1_SX300.jpg,Approved,Vietnam War,115,A Gathering of Eagles,60%,,6.2,tt0057090,796
COMMAND DECISION,COMMAND DECISION,APPROVED,FIRST POST-WAR MOVIE ABOUT HEAVING BOMBING OF GERMANY. ARTIFICIAL WITH APPEARANCE OF CONGRESSIONAL COMMITTEE SEEKING ANSWERS ABOUT COMBAT LOSSES. AF PROVIDED PLANES AND COMBAT FOOTAGE.,,,,,,TRUE,1948,2/1/1949,"Clark Gable, Walter Pidgeon, Van Johnson, Brian Donlevy",2 nominations.,TRUE,USA,Sam Wood,"Action, Drama, War","General Dennis of the US Force in England in World War II finds that he must order his planes deeper and deeper into Germany to prevent the production of military jet planes that will turn the tide of battle to the Germans. He must fight congressmen, and his own chain of command to win the political battle before he can send his planes out. His problem is complicated by a very narrow window of good weather necessary to allow his effort to be successful. Adapted from a stage play, it attempts to look at the challenges of command in the political arena.",https://m.media-amazon.com/images/M/MV5BOGU4MmU0NGItZDk1MS00NzIzLTg3YzAtMjE1YmYwNjkxYzIzXkEyXkFqcGdeQXVyMDI2NDg0NQ@@._V1_SX300.jpg,Passed,,112,Command Decision,84%,,7.3,tt0040242,"1,846"
TUGGER,TUGGER,APPROVED,"APPROVED WHAT IS ESSENTIALLY NON-PRODUCTION ASSISTANCE: TECHNICAL ADVICE, STOCK FOOTAGE, RESEARCH, INTERVIEWS, ETC. THIS IS AN ANIMATED FILM FOR CHILDREN THAT FEATURE THE USAF THUNDERBIRDS.",,,,,,TRUE,2005,7/15/2005,"Jim Belushi, Scott 'Carrot Top' Thompson, Lance LeGault, Tom Kinney",,FALSE,USA,Jeffrey James Varab,Animation,"Tugger is a little jeep that had his engine fan replaced by an airplane propeller during World War II. The film follows Tugger, with his friend Shorty, as he follows his dreams of one day taking to the skies and flying like a plane.",https://m.media-amazon.com/images/M/MV5BMTY5MjU0NjEzNF5BMl5BanBnXkFtZTcwOTU4Mjk5Nw@@._V1_SX300.jpg,G,Iraq War,65,Tugger: The Jeep 4x4 Who Wanted to Fly,,,5.4,tt0464280,82
DON'T GIVE UP THE SHIP,DON'T GIVE UP THE SHIP,LIMITED,JERRY LEWIS LOSES A BATTLESHIP AND CAN'T REMEMBER WHERE HE PUT IT. ONE OF HIS BEST COMEDIES. NAVY PROVIDED A FEW SCENES OF SHIPS AS BACKGROUND,,,,,,TRUE,1959,7/3/1959,"Jerry Lewis, Dina Merrill, Diana Spencer, Mickey Shaughnessy",,FALSE,USA,Norman Taurog,Comedy,"John Paul Steckler was the Junior Officer aboard a destroyer when WWII ended. He gets stuck with the job of sailing the ship to the states to be decommissioned. Now years latter, no one knows where the ship is. He has a choice. Find the ship, or pay for it, Now! If only Prudence, to whom he just got married, could understand why he isn't there for his Honeymoon.",https://m.media-amazon.com/images/M/MV5BZmQ4NTg2NzYtMjhjNi00NzI3LWEwODMtZDE1OTE0M2JhODdlXkEyXkFqcGdeQXVyMDI2NDg0NQ@@._V1_SX300.jpg,Approved,Vietnam War,89,Don't Give Up the Ship,42%,,6.5,tt0052749,641
DESTROYER,DESTROYER,APPROVED,STORY OF THE BUILDING AND SERVICE OF A DESTROYER DURING WORLD WAR II. NAVY GAVE ACCESS TO SHIPYARD AND THEN SUPPLIED DESTROYER FOR FILMING AT SEA.,,,,,,TRUE,1943,8/19/1943,"Edward G. Robinson, Glenn Ford, Marguerite Chapman, Edgar Buchanan",,FALSE,USA,"William A. Seiter, Ray Enright","Adventure, Drama, War","Flagwaving story of a new American destroyer, the JOHN PAUL JONES, from the day her keel is laid, to what was very nearly her last voyage. Among the crew, is Steve Boleslavski, a shipyard welder that helped build her, who reenlists, with his old rank of Chief boatswain's mate. After failing her sea trials, she is assigned to the mail run, until caught up in a disparate battle with a Japanese sub. After getting torpedoed, and on the verge of sinking, the Captain, and crew hatch a plan to try and save the ship, and destroy the sub.",https://m.media-amazon.com/images/M/MV5BMjUxZGJlZTctOTRjMC00Zjc0LTliNDAtYWExMTJiZjJkMjY5XkEyXkFqcGdeQXVyNjQzNDI3NzY@._V1_SX300.jpg,Approved,World War II,99,Destroyer,58%,,6.3,tt0035800,"1,047"
TOMORROW NEVER DIES,TOMORROW NEVER DIES,APPROVED,"PRODUCTION COMPANY MADE A FEW TECHNICAL CHANGES AND WE APPROVED ASSISTING JAMES BOND IN MAKING A HALO JUMP FROM ONE OF ""OUR"" RAF BASES IN ENGLAND.",,,,,,TRUE,1997,12/19/1997,"Pierce Brosnan, Jonathan Pryce, Michelle Yeoh, Teri Hatcher",Nominated for 1 Golden Globe. Another 6 wins & 9 nominations.,TRUE,"UK, USA",Roger Spottiswoode,"Action, Adventure, Thriller","Agent James Bond 007 is on a mission which includes a media tycoon, his former lover and a Chinese agent. Elliot Carver wants to complete his global media empire, but in order for this to work, he must achieve broadcasting rights in China. Carver wants to start up World War III by starting a confrontation over British and Chinese waters. Bond gains the help of Wai Lin on his quest to stop him, but how will Bond feel when he meets up with his former lover, who is now Carver's wife.",https://m.media-amazon.com/images/M/MV5BMTM1MTk2ODQxNV5BMl5BanBnXkFtZTcwOTY5MDg0NA@@._V1_SX300.jpg,PG-13,,119,Tomorrow Never Dies,57%,52,6.5,tt0120347,"178,911"
ROBOCOP,ROBOCOP,DENIED,DOD FOUND NOTHING IN THE FILM BENEFICIAL TO THE DEPARTMENT. THEY FOUND THE FILM TO BE VIOLENT AND BLOODY. THE REQUEST FOR STOCK FOOTAGE WAS DENIED.,,,,,,TRUE,1987,7/17/1987,"Peter Weller, Nancy Allen, Dan O'Herlihy, Ronny Cox",Nominated for 2 Oscars. Another 11 wins & 10 nominations.,TRUE,USA,Paul Verhoeven,"Action, Crime, Sci-Fi, Thriller","Detroit - in the future - is crime-ridden and run by a massive company. The company has developed a huge crime-fighting robot, which unfortunately develops a rather dangerous glitch. The company sees a way to get back in favor with the public when policeman Alex Murphy is killed by a street gang. Murphy's body is reconstructed within a steel shell and called RoboCop. RoboCop is very successful against criminals and becomes a target of supervillian Boddicker.",https://m.media-amazon.com/images/M/MV5BZWVlYzU2ZjQtZmNkMi00OTc3LTkwZmYtZDVjNmY4OWFmZGJlXkEyXkFqcGdeQXVyMTQxNzMzNDI@._V1_SX300.jpg,R,,102,RoboCop,90%,67,7.5,tt0093870,"229,171"
TURKEY SHOOT,TURKEY SHOOT,APPROVED,SCRIPT WAS APPROVED BY THE DEPARTMENT AS WELL AS THE NAVY AFTER BEING REVIEWED AND FINDING EVERYTHING QUITE FACTUAL. NO RECORD OF FILM EVER BEING MADE,,,,,,TRUE,1982,9/2/1983,"Steve Railsback, Olivia Hussey, Michael Craig, Carmen Duncan",,FALSE,"Australia, UK",Brian Trenchard-Smith,"Drama, Horror, Sci-Fi, Thriller","In a totalitarian country, any subversives, undesirables and ""deviants"" are sent to a prison camp to be rehabilitated and reeducated. The camp is run in fascist fashion, with guards torturing and killing prisoners for sport. Their pinnacle of the guards oppression is an event where a select band of prisoners are set free in the surrounding bush, to be hunted by the guards and special guests for sport - the Turkey Shoot.",https://m.media-amazon.com/images/M/MV5BZGUyMDVhOTgtM2UzYi00MjkzLTg2ZTgtNWZkYWEwYTQxMGU1XkEyXkFqcGdeQXVyMTQxNzMzNDI@._V1_SX300.jpg,R,,80,Turkey Shoot,,,5.9,tt0082338,"2,858"
FRAULEIN,FRAULEIN,LIMITED,"ARMY PROVIDED LIMITED ASSISTANCE WITH MEN, BACKGROUND, AND EQUIPMENT ON LOCATION IN GERMANY -- FILM SET IN LAST DAYS OF THE WAR AND DURING THE OCCUPATION",,,,,,TRUE,1958,6/25/1958,"Dana Wynter, Mel Ferrer, Dolores Michaels, Margaret Hayes",,FALSE,USA,Henry Koster,"Romance, War, Drama","A Nazi's fiancee helps an escaped U.S. soldier, then meets him in postwar Berlin.",https://m.media-amazon.com/images/M/MV5BMjIyMjk1NDc0MV5BMl5BanBnXkFtZTgwOTg3Nzk1MDE@._V1_SX300.jpg,Not Rated,Vietnam War,95,FrÃ¤ulein,,,6.8,tt0051640,153
JUDGEMENT IN BERLIN,JUDGEMENT IN BERLIN,APPROVED,THE PRODUCTION RECEIVED ASSISTANCE IN FILMING FROM THE DOD AND THE AIR FORCE. THE FILMING WAS DONE AT TEMPELHOF AIRPORT (AIR FORCE INSTALLATION AT THE TIME].,,,,,,TRUE,1988,5/6/1988,"Martin Sheen, Sam Wanamaker, Max Gail, JÃ¼rgen Heinrich",,FALSE,"West Germany, USA",Leo Penn,Drama,American judge in Germany must decide if the hijacking of an East German plane into West Berlin was justified.,https://m.media-amazon.com/images/M/MV5BMTgwMDgzNjc5M15BMl5BanBnXkFtZTcwNzAwMTUyMQ@@._V1_SX300.jpg,PG,,96,Judgement in Berlin,,,5.8,tt0095415,647
PASS THE AMMUNITION,PASS THE AMMUNITION,DENIED,"TOO UNREALISTIC, CAUSES MISINTERPRETATION OF THE DUTIES OF THE GUARD AND ITS RELATIONSHIP AND THE TOWN; TOO VULGAR. REQUEST DENIED. NO RECORD OF FILM BEING MADE",,,,,,TRUE,1988,3/4/1988,"Bill Paxton, Linda Kozlowski, Tim Curry, Annie Potts",,FALSE,USA,David Beaird,Comedy,"A corrupt television preacher and his congregation are held hostage by a woman, her lover, and her two cousins in an attempt to avenge the theft of her inheritance. A quirky look at the dishonesty of the televangelist industry.",https://m.media-amazon.com/images/M/MV5BZDEwODYxY2UtMjE5NC00YzkyLTg5NTYtY2QxNDQzY2UyMTlmXkEyXkFqcGdeQXVyMTEwODg2MDY@._V1_SX300.jpg,R,,93,Pass the Ammo,67%,,6.2,tt0095832,444
ROBOT JOX,ROBOT JOX,APPROVED,THE FILM WAS APPROVED AND STOCK FOOTAGE WAS FURNISHED -- COMPANY CLAIMED THAT FOOTAGE IS NOT AVAILABLE THROUGH COMMERCIAL SOURCES. NO RECORD OF FILM BEING MADE.,,,,,,TRUE,1989,11/21/1990,"Gary Graham, Anne-Marie Johnson, Paul Koslo, Robert Sampson",1 nomination.,TRUE,USA,Stuart Gordon,"Action, Sci-Fi, Thriller","It is post-World War III. War is outlawed. In its place, are matches between large Robots called Robot Jox. These matches take place between two large superpowers over disputed territories. The main character Achilles is a pilot in one of the large Robots. The plot revolves around him and a match for the state of Alaska.",https://m.media-amazon.com/images/M/MV5BMGVmNjRiMTYtNDlmNC00ZTk0LWI4ZjMtMGEzMGYwMDhiOGMxXkEyXkFqcGdeQXVyMTQxNzMzNDI@._V1_SX300.jpg,PG,Gulf War,85,Robot Jox,41%,,5.4,tt0102800,"5,619"
CODE NAME: DELTA FORCE,CODE NAME: DELTA FORCE,DENIED,"THE CONCEPT OF THE FILM WAS INACCURATE AND CAST THE US. GOVERNMENT, DOD, AND SPECIAL OPERATIONS FORCES IN UNFAVORABLE LIGHT. ASSISTANCE DENIED. NO RECORD FILM MADE",,,,,,FALSE,,,,,,,,,,,,,,,,,,,
